{
  "$schema": "https://raw.githubusercontent.com/xila-project/applications/main/schemas/shell-shortcut.schema.json",
  "name": "Calculator",
  "command": "/applications/executables/wasm",
  "arguments": [
    "@bundle/bin/calculator.wasm"
  ],
  "terminal": false,
  "icon_string": "Ca",
  "icon_color": [
    158,
    158,
    158
  ]
}
